{
  "asset_access_level": "open_fixture",
  "blinding": {
    "prior_reviews_hidden": true,
    "reviewer_answers_separate": true,
    "style_labels_withheld": true
  },
  "created_at": "2026-09-04T06:00:00Z",
  "gate_approval_id": null,
  "gate_status": "blocked",
  "item_count": 1,
  "item_manifest": {
    "byte_size": 1059,
    "mime_type": "application/x-ndjson",
    "path": "items.jsonl",
    "sha256": "1023ddf27bed82c942767d917cfee7266125c5ceeaa5cc172a9c661e59dd40f6"
  },
  "package_content_sha256": "33be59c5d6f4098b82a75497e29d5f10f0332cefbf5aebae915460e69fe7e57d",
  "package_id": "review_package_17144d3382f103ce1d3704d9",
  "package_version": "1.0.0",
  "review_round": 1,
  "rubric_dimensions": [
    "character_identity",
    "style_or_font_attribution",
    "structure",
    "stroke_logic",
    "historical_fidelity",
    "source_fidelity",
    "experimental_suitability",
    "inference_scope"
  ],
  "schema_version": "1.0.0",
  "subject_type": "glyph_instance"
}
